{
  "schemaVersion": 1,
  "sourceRevision": "1fffec16713ca76c85dcda696abca9d011f9c51b",
  "task": {
    "taskId": "PILOT-P2",
    "requirementIds": [
      "VES-EXE-001"
    ],
    "dependencyTaskIds": [],
    "component": "api",
    "changeScope": [
      "index.js",
      "readme.md",
      "test.js"
    ],
    "protectedPaths": [
      ".git",
      ".verchestra"
    ],
    "verificationCommands": [
      "node --test test.js"
    ],
    "doneCriteria": [
      "index.js exports levenshteinSimilarity(value, other, insensitive) returning 1 - distance / max(value.length, other.length), and 1 when both strings are empty",
      "levenshteinEditDistance and its behaviour are unchanged",
      "A new separate test named levenshteinSimilarity in test.js covers empty, equal, disjoint, sitting/kitten and case (in)sensitivity; reverting index.js makes it fail",
      "readme.md documents levenshteinSimilarity in its Contents list, its API export sentence, and its own API section"
    ],
    "risk": "low",
    "expectedCommitBoundary": "feat(api): add levenshteinSimilarity"
  },
  "gates": [
    {
      "gateId": "gate:target-tests",
      "requirementIds": [
        "VES-EXE-001"
      ],
      "declaredCommand": "node --test test.js",
      "commandRef": "node",
      "args": [
        "--test",
        "test.js"
      ],
      "cwd": ".",
      "timeoutMs": 120000,
      "outputLimitBytes": 1000000,
      "resultProtocol": "test-summary",
      "minimumTests": 5
    }
  ],
  "budgets": {
    "maximumCostUsd": 8,
    "maximumTokens": 3000000,
    "maximumDurationMs": 1800000
  },
  "onGateFailure": {
    "maxAttempts": 2,
    "feedbackToDriver": true,
    "escalateAfter": 2
  },
  "driver": {
    "driverId": "claude-code",
    "model": "claude-sonnet-5"
  },
  "verifier": {
    "driverId": "codex",
    "model": "gpt-5.2-codex"
  },
  "instructions": "Add a small feature: export a new function `levenshteinSimilarity(value, other, insensitive)` from index.js. It returns `1 - levenshteinEditDistance(value, other, insensitive) / Math.max(value.length, other.length)` and returns `1` when both strings are empty. Lengths are JavaScript string lengths (UTF-16 code units), the same unit the distance uses, and `insensitive` means exactly what it means for levenshteinEditDistance. Give it a JSDoc comment in the style of the existing function. Do not change levenshteinEditDistance or its behaviour. In test.js, import it next to the existing import and add a new, separate top-level test named `levenshteinSimilarity` that asserts: two empty strings give 1; `abc` and `abc` give 1; `a` and the empty string give 0; `sitting` and `kitten` give `1 - 3 / 7` in both argument orders; `A` and `a` give 0 by default and 1 with `insensitive` true. Do not change the existing tests. In readme.md: change the sentence `This package exports the identifier levenshteinEditDistance.` so it names both identifiers, add a `levenshteinSimilarity(value, other[, insensitive])` section after the existing function's API section using the same heading levels and parameter layout, and add that section to the Contents list."
}
