{
  "schemaVersion": 1,
  "sourceRevision": "1fffec16713ca76c85dcda696abca9d011f9c51b",
  "task": {
    "taskId": "PILOT-P3",
    "requirementIds": [
      "VES-EXE-001"
    ],
    "dependencyTaskIds": [],
    "component": "cli",
    "changeScope": [
      "cli.js",
      "lib",
      "package.json",
      "test.js"
    ],
    "protectedPaths": [
      ".git",
      ".verchestra"
    ],
    "verificationCommands": [
      "node --test test.js"
    ],
    "doneCriteria": [
      "lib/cli-input.js exports parseInput(value), returning the two words when the comma-and-whitespace split yields exactly two entries and undefined otherwise",
      "cli.js imports parseInput from ./lib/cli-input.js and no longer splits the input itself; CLI behaviour is unchanged, including rejection of leading or trailing separators",
      "package.json files publishes lib/ so the installed CLI keeps working",
      "A new separate test named parseInput in test.js imports ./lib/cli-input.js directly; removing lib/cli-input.js makes it fail, and all existing tests still pass unchanged"
    ],
    "risk": "medium",
    "expectedCommitBoundary": "refactor(cli): extract input parsing into lib/cli-input.js"
  },
  "gates": [
    {
      "gateId": "gate:target-tests",
      "requirementIds": [
        "VES-EXE-001"
      ],
      "declaredCommand": "node --test test.js",
      "commandRef": "node",
      "args": [
        "--test",
        "test.js"
      ],
      "cwd": ".",
      "timeoutMs": 120000,
      "outputLimitBytes": 1000000,
      "resultProtocol": "test-summary",
      "minimumTests": 5
    }
  ],
  "budgets": {
    "maximumCostUsd": 8,
    "maximumTokens": 3000000,
    "maximumDurationMs": 1800000
  },
  "onGateFailure": {
    "maxAttempts": 2,
    "feedbackToDriver": true,
    "escalateAfter": 2
  },
  "driver": {
    "driverId": "claude-code",
    "model": "claude-sonnet-5"
  },
  "verifier": {
    "driverId": "codex",
    "model": "gpt-5.5"
  },
  "instructions": "Refactor without changing behaviour. Move the CLI's input parsing out of cli.js into a new module lib/cli-input.js that exports `parseInput(value)`. parseInput takes the raw input string that getDistance receives today and applies exactly today's rule, `value.split(',').join(' ').split(/\\s+/)`: it returns the resulting array when it has exactly two entries and `undefined` otherwise. Behaviour must stay identical, including today's rejection of leading or trailing separators (for example ` sitting kitten` and `sitting kitten,` are still rejected). In cli.js, import parseInput from './lib/cli-input.js' and use it in getDistance; the usage error path is unchanged. Add `lib/` to the `files` array in package.json so the published CLI keeps working, and change nothing else in package.json. Use JSDoc types in the style of the repository. In test.js, import parseInput from './lib/cli-input.js' and add a new, separate top-level test named `parseInput` that covers: spaces, commas, a comma followed by a space, one word (undefined), three words (undefined), and a leading separator (undefined). Do not change the existing tests."
}
